Unnamed: 0.1,Unnamed: 0,filename,url,download_date,date
0.0,0.0,12-12-2025.pdf,https://www.wafagestion.com/sites/default/files/documents-en-masse/18-12-2025/weekly_opcvm_12_12_2025.pdf,2025-12-19 18:42:34,2025-12-12
1.0,1.0,05-12-2025.pdf,https://www.wafagestion.com/sites/default/files/documents-en-masse/08-12-2025/weekly_opcvm_05_12_2025.pdf,2025-12-19 18:42:27,2025-12-05
2.0,2.0,28-11-2025.pdf,https://www.wafagestion.com/sites/default/files/documents-en-masse/08-12-2025/weekly_opcvm_28_11_2025.pdf,2025-12-19 18:42:30,2025-11-28
3.0,3.0,21-11-2025.pdf,https://www.wafagestion.com/sites/default/files/documents-en-masse/24-11-2025/weekly_opcvm_21_11_2025.pdf,2025-12-19 18:42:28,2025-11-21
4.0,4.0,14-11-2025.pdf,https://www.wafagestion.com/sites/default/files/documents-en-masse/17-11-2025/weekly_opcvm_14_11_2025.pdf,2025-12-19 18:42:31,2025-11-14
5.0,5.0,07-11-2025.pdf,https://www.wafagestion.com/sites/default/files/documents-en-masse/10-11-2025/weekly_opcvm_07_11_2025.pdf,2025-12-19 18:42:32,2025-11-07
6.0,6.0,31-10-2025.pdf,https://www.wafagestion.com/sites/default/files/documents-en-masse/03-11-2025/weekly_opcvm_31_10_2025.pdf,2025-12-19 18:42:26,2025-10-31
7.0,7.0,24-10-2025.pdf,https://www.wafagestion.com/sites/default/files/documents-en-masse/28-10-2025/weekly_opcvm_24_10_2025.pdf,2025-12-19 18:42:29,2025-10-24
8.0,8.0,17-10-2025.pdf,https://www.wafagestion.com/sites/default/files/documents-en-masse/21-10-2025/weekly_opcvm_17_10_2025.pdf,2025-12-19 18:42:33,2025-10-17
9.0,9.0,10-10-2025.pdf,https://www.wafagestion.com/sites/default/files/documents-en-masse/13-10-2025/weekly_opcvm_10_10_2025.pdf,2025-12-19 18:42:25,2025-10-10
10.0,10.0,03-10-2025.pdf,https://www.wafagestion.com/sites/default/files/documents-en-masse/06-10-2025/weekly_opcvm_03_10_2025.pdf,2025-12-19 18:42:44,2025-10-03
11.0,11.0,26-09-2025.pdf,https://www.wafagestion.com/sites/default/files/documents-en-masse/30-09-2025/weekly_opcvm_26_09_2025.pdf,2025-12-19 18:42:36,2025-09-26
12.0,12.0,19-09-2025.pdf,https://www.wafagestion.com/sites/default/files/documents-en-masse/23-09-2025/weekly_opcvm_19_09_2025.pdf,2025-12-19 18:42:42,2025-09-19
13.0,13.0,12-09-2025.pdf,https://www.wafagestion.com/sites/default/files/documents-en-masse/15-09-2025/weekly_opcvm_12_09_2025.pdf,2025-12-19 18:42:45,2025-09-12
14.0,14.0,08-09-2025.pdf,https://www.wafagestion.com/sites/default/files/documents-en-masse/09-09-2025/weekly_opcvm_08_09_2025.pdf,2025-12-19 18:42:39,2025-09-08
15.0,15.0,29-08-2025.pdf,https://www.wafagestion.com/sites/default/files/documents-en-masse/01-09-2025/weekly_opcvm_29_08_2025.pdf,2025-12-19 18:42:38,2025-08-29
16.0,16.0,22-08-2025.pdf,https://www.wafagestion.com/sites/default/files/documents-en-masse/26-08-2025/weekly_opcvm_22_08_2025.pdf,2025-12-19 18:42:41,2025-08-22
17.0,17.0,15-08-2025.pdf,https://www.wafagestion.com/sites/default/files/documents-en-masse/18-08-2025/weekly_opcvm_15_08_2025.pdf,2025-12-19 18:42:36,2025-08-15
18.0,18.0,08-08-2025.pdf,https://www.wafagestion.com/sites/default/files/documents-en-masse/11-08-2025/weekly_opcvm_08_08_2025.pdf,2025-12-19 18:42:43,2025-08-08
19.0,19.0,01-08-2025.pdf,https://www.wafagestion.com/sites/default/files/documents-en-masse/04-08-2025/weekly_opcvm_01_08_2025.pdf,2025-12-19 18:42:37,2025-08-01
20.0,20.0,25-07-2025.pdf,https://www.wafagestion.com/sites/default/files/documents-en-masse/28-07-2025/weekly_opcvm_25_07_2025.pdf,2025-12-19 18:42:52,2025-07-25
21.0,21.0,18-07-2025.pdf,https://www.wafagestion.com/sites/default/files/documents-en-masse/21-07-2025/weekly_opcvm_18_07_2025.pdf,2025-12-19 18:42:49,2025-07-18
22.0,22.0,11-07-2025.pdf,https://www.wafagestion.com/sites/default/files/documents-en-masse/14-07-2025/weekly_opcvm_11_07_2025.pdf,2025-12-19 18:42:47,2025-07-11
23.0,23.0,04-07-2025.pdf,https://www.wafagestion.com/sites/default/files/documents-en-masse/07-07-2025/weekly_opcvm_04_07_2025.pdf,2025-12-19 18:42:54,2025-07-04
24.0,24.0,30-06-2025.pdf,https://www.wafagestion.com/sites/default/files/documents-en-masse/01-07-2025/weekly_opcvm_30_06_2025.pdf,2025-12-19 18:42:55,2025-06-30
25.0,25.0,20-06-2025.pdf,https://www.wafagestion.com/sites/default/files/documents-en-masse/23-06-2025/weekly_opcvm_20_06_2025.pdf,2025-12-19 18:42:56,2025-06-20
26.0,26.0,13-06-2025.pdf,https://www.wafagestion.com/sites/default/files/documents-en-masse/16-06-2025/weekly_opcvm_13_06_2025.pdf,2025-12-19 18:42:50,2025-06-13
27.0,27.0,06-06-2025.pdf,https://www.wafagestion.com/sites/default/files/documents-en-masse/10-06-2025/weekly_opcvm_06_06_2025.pdf,2025-12-19 18:42:51,2025-06-06
28.0,28.0,30-05-2025.pdf,https://www.wafagestion.com/sites/default/files/documents-en-masse/02-06-2025/weekly_opcvm_30_05_2025.pdf,2025-12-19 18:42:51,2025-05-30
29.0,29.0,23-05-2025.pdf,https://www.wafagestion.com/sites/default/files/documents-en-masse/26-05-2025/weekly_opcvm_23_05_2025.pdf,2025-12-19 18:42:48,2025-05-23
30.0,30.0,09-05-2025.pdf,https://www.wafagestion.com/sites/default/files/documents-en-masse/15-05-2025/weekly_opcvm_09_05_2025.pdf,2025-12-19 18:42:59,2025-05-09
31.0,31.0,02-05-2025.pdf,https://www.wafagestion.com/sites/default/files/documents-en-masse/05-05-2025/weekly_opcvm_02_05_2025.pdf,2025-12-19 18:43:02,2025-05-02
32.0,32.0,25-04-2025.pdf,https://www.wafagestion.com/sites/default/files/documents-en-masse/28-04-2025/weekly_opcvm_25_04_2025.pdf,2025-12-19 18:43:03,2025-04-25
33.0,33.0,18-04-2025.pdf,https://www.wafagestion.com/sites/default/files/documents-en-masse/21-04-2025/weekly_opcvm_18_04_2025.pdf,2025-12-19 18:43:00,2025-04-18
34.0,34.0,11-04-2025.pdf,https://www.wafagestion.com/sites/default/files/documents-en-masse/14-04-2025/weekly_opcvm_11_04_2025.pdf,2025-12-19 18:42:58,2025-04-11
35.0,35.0,28-03-2025.pdf,https://www.wafagestion.com/sites/default/files/documents-en-masse/02-04-2025/weekly_opcvm_28_03_2025.pdf,2025-12-19 18:43:01,2025-03-28
36.0,36.0,21-03-2025.pdf,https://www.wafagestion.com/sites/default/files/documents-en-masse/25-03-2025/weekly_opcvm_21_03_2025.pdf,2025-12-19 18:43:06,2025-03-21
37.0,37.0,14-03-2025.pdf,https://www.wafagestion.com/sites/default/files/documents-en-masse/17-03-2025/weekly_opcvm_14_03_2025.pdf,2025-12-19 18:43:03,2025-03-14
38.0,38.0,07-03-2025.pdf,https://www.wafagestion.com/sites/default/files/documents-en-masse/10-03-2025/weekly_opcvm_07_03_2025.pdf,2025-12-19 18:43:05,2025-03-07
39.0,39.0,28-02-2025.pdf,https://www.wafagestion.com/sites/default/files/documents-en-masse/03-03-2025/weekly_opcvm_28_02_2025.pdf,2025-12-19 18:43:04,2025-02-28
40.0,40.0,21-02-2025.pdf,https://www.wafagestion.com/sites/default/files/documents-en-masse/24-02-2025/weekly_opcvm_21_02_2025.pdf,2025-12-19 18:43:11,2025-02-21
41.0,41.0,14-02-2025.pdf,https://www.wafagestion.com/sites/default/files/documents-en-masse/18-02-2025/weekly_opcvm_14_02_2025.pdf,2025-12-19 18:43:16,2025-02-14
42.0,42.0,07-02-2025.pdf,https://www.wafagestion.com/sites/default/files/documents-en-masse/10-02-2025/weekly_opcvm_07_02_2025.pdf,2025-12-19 18:43:16,2025-02-07
43.0,43.0,31-01-2025.pdf,https://www.wafagestion.com/sites/default/files/documents-en-masse/03-02-2025/weekly_opcvm_31_01_2025.pdf,2025-12-19 18:43:12,2025-01-31
44.0,44.0,24-01-2025.pdf,https://www.wafagestion.com/sites/default/files/documents-en-masse/29-01-2025/weekly_opcvm_24_01_2025.pdf,2025-12-19 18:43:18,2025-01-24
45.0,45.0,17-01-2025.pdf,https://www.wafagestion.com/sites/default/files/documents-en-masse/21-01-2025/weekly_opcvm_17_01_2025.pdf,2025-12-19 18:43:13,2025-01-17
46.0,46.0,10-01-2025.pdf,https://www.wafagestion.com/sites/default/files/documents-en-masse/13-01-2025/weekly_opcvm_10_01_2025.pdf,2025-12-19 18:43:15,2025-01-10
47.0,47.0,06-01-2025.pdf,https://www.wafagestion.com/sites/default/files/documents-en-masse/06-01-2025/weekly_opcvm_06_01_2025.pdf,2025-12-19 18:43:19,2025-01-06
48.0,48.0,27-12-2024.pdf,https://www.wafagestion.com/sites/default/files/documents-en-masse/30-12-2024/weekly_opcvm_27_12_2024.pdf,2025-12-19 18:43:10,2024-12-27
49.0,49.0,20-12-2024.pdf,https://www.wafagestion.com/sites/default/files/documents-en-masse/30-12-2024/weekly_opcvm_20_12_2024.pdf,2025-12-19 18:43:08,2024-12-20
50.0,50.0,13-12-2024.pdf,https://www.wafagestion.com/sites/default/files/documents-en-masse/16-12-2024/weekly_opcvm_13_12_2024.pdf,2025-12-19 18:43:21,2024-12-13
51.0,51.0,06-12-2024.pdf,https://www.wafagestion.com/sites/default/files/documents-en-masse/09-12-2024/weekly_opcvm_06_12_2024.pdf,2025-12-19 18:43:24,2024-12-06
52.0,52.0,29-11-2024.pdf,https://www.wafagestion.com/sites/default/files/documents-en-masse/02-12-2024/weekly_opcvm_29_11_2024.pdf,2025-12-19 18:43:28,2024-11-29
53.0,53.0,22-11-2024.pdf,https://www.wafagestion.com/sites/default/files/documents-en-masse/25-11-2024/weekly_opcvm_22_11_2024.pdf,2025-12-19 18:43:27,2024-11-22
54.0,54.0,15-11-2024.pdf,https://www.wafagestion.com/sites/default/files/documents-en-masse/19-11-2024/weekly_opcvm_15_11_2024.pdf,2025-12-19 18:43:33,2024-11-15
55.0,55.0,08-11-2024.pdf,https://www.wafagestion.com/sites/default/files/documents-en-masse/11-11-2024/weekly_opcvm_08_11_2024.pdf,2025-12-19 18:43:23,2024-11-08
56.0,56.0,01-11-2024.pdf,https://www.wafagestion.com/sites/default/files/documents-en-masse/04-11-2024/weekly_opcvm_01_11_2024.pdf,2025-12-19 18:43:36,2024-11-01
57.0,57.0,25-10-2024.pdf,https://www.wafagestion.com/sites/default/files/documents-en-masse/04-11-2024/weekly_opcvm_25_10_2024.pdf,2025-12-19 18:43:25,2024-10-25
58.0,58.0,18-10-2024.pdf,https://www.wafagestion.com/sites/default/files/documents-en-masse/21-10-2024/weekly_opcvm_18_10_2024.pdf,2025-12-19 18:43:35,2024-10-18
59.0,59.0,11-10-2024.pdf,https://www.wafagestion.com/sites/default/files/documents-en-masse/14-10-2024/weekly_opcvm_11_10_2024.pdf,2025-12-19 18:43:31,2024-10-11
60.0,60.0,04-10-2024.pdf,https://www.wafagestion.com/sites/default/files/documents-en-masse/07-10-2024/weekly_opcvm_04_10_2024.pdf,2025-12-19 18:43:41,2024-10-04
61.0,61.0,27-09-2024.pdf,https://www.wafagestion.com/sites/default/files/documents-en-masse/30-09-2024/weekly_opcvm_27_09_2024.pdf,2025-12-19 18:43:40,2024-09-27
62.0,62.0,20-09-2024.pdf,https://www.wafagestion.com/sites/default/files/documents-en-masse/23-09-2024/weekly_opcvm_20_09_2024.pdf,2025-12-19 18:43:38,2024-09-20
63.0,63.0,13-09-2024.pdf,https://www.wafagestion.com/sites/default/files/documents-en-masse/19-09-2024/weekly_opcvm_13_09_2024.pdf,2025-12-19 18:43:51,2024-09-13
64.0,64.0,06-09-2024.pdf,https://www.wafagestion.com/sites/default/files/documents-en-masse/09-09-2024/weekly_opcvm_06_09_2024.pdf,2025-12-19 18:43:52,2024-09-06
65.0,65.0,31-08-2024.pdf,https://www.wafagestion.com/sites/default/files/documents-en-masse/02-09-2024/weekly_opcvm_31_08_2024.pdf,2025-12-19 18:43:48,2024-08-31
66.0,66.0,23-08-2024.pdf,https://www.wafagestion.com/sites/default/files/documents-en-masse/26-08-2024/weekly_opcvm_23_08_2024.pdf,2025-12-19 18:43:45,2024-08-23
67.0,67.0,16-08-2024.pdf,https://www.wafagestion.com/sites/default/files/documents-en-masse/22-08-2024/weekly_opcvm_16_08_2024.pdf,2025-12-19 18:43:47,2024-08-16
68.0,68.0,09-08-2024.pdf,https://www.wafagestion.com/sites/default/files/documents-en-masse/15-08-2024/weekly_opcvm_09_08_2024.pdf,2025-12-19 18:43:50,2024-08-09
69.0,69.0,02-08-2024.pdf,https://www.wafagestion.com/sites/default/files/documents-en-masse/15-08-2024/weekly_opcvm_02_08_2024.pdf,2025-12-19 18:43:46,2024-08-02
70.0,70.0,26-07-2024.pdf,https://www.wafagestion.com/sites/default/files/documents-en-masse/15-08-2024/weekly_opcvm_26_07_2024.pdf,2025-12-19 18:44:05,2024-07-26
71.0,71.0,19-07-2024.pdf,https://www.wafagestion.com/sites/default/files/documents-en-masse/22-07-2024/weekly_opcvm_19_07_2024.pdf,2025-12-19 18:44:00,2024-07-19
72.0,72.0,12-07-2024.pdf,https://www.wafagestion.com/sites/default/files/documents-en-masse/15-07-2024/weekly_opcvm_12_07_2024.pdf,2025-12-19 18:44:07,2024-07-12
73.0,73.0,05-07-2024.pdf,https://www.wafagestion.com/sites/default/files/documents-en-masse/09-07-2024/weekly_opcvm_05_07_2024.pdf,2025-12-19 18:43:55,2024-07-05
74.0,74.0,28-06-2024.pdf,https://www.wafagestion.com/sites/default/files/documents-en-masse/01-07-2024/weekly_opcvm_28_06_2024.pdf,2025-12-19 18:44:03,2024-06-28
75.0,75.0,21-06-2024.pdf,https://www.wafagestion.com/sites/default/files/documents-en-masse/24-06-2024/weekly_opcvm_21_06_2024.pdf,2025-12-19 18:43:56,2024-06-21
76.0,76.0,14-06-2024.pdf,https://www.wafagestion.com/sites/default/files/documents-en-masse/24-06-2024/weekly_opcvm_14_06_2024.pdf,2025-12-19 18:44:06,2024-06-14
77.0,77.0,07-06-2024.pdf,https://www.wafagestion.com/sites/default/files/documents-en-masse/12-06-2024/weekly_opcvm_07_06_2024.pdf,2025-12-19 18:44:09,2024-06-07
78.0,78.0,31-05-2024.pdf,https://www.wafagestion.com/sites/default/files/documents-en-masse/06-06-2024/weekly_opcvm_31_05_2024.pdf,2025-12-19 18:43:59,2024-05-31
79.0,79.0,24-05-2024.pdf,https://www.wafagestion.com/sites/default/files/documents-en-masse/06-06-2024/weekly_opcvm_24_05_2024.pdf,2025-12-19 18:43:57,2024-05-24
80.0,80.0,17-05-2024.pdf,https://www.wafagestion.com/sites/default/files/documents-en-masse/20-05-2024/weekly_opcvm_17_05_2024.pdf,2025-12-19 18:44:24,2024-05-17
81.0,81.0,10-05-2024.pdf,https://www.wafagestion.com/sites/default/files/documents-en-masse/14-05-2024/weekly_opcvm_10_05_2024.pdf,2025-12-19 18:44:18,2024-05-10
82.0,82.0,03-05-2024.pdf,https://www.wafagestion.com/sites/default/files/documents-en-masse/06-05-2024/weekly_opcvm_03_05_2024.pdf,2025-12-19 18:44:13,2024-05-03
83.0,83.0,26-04-2024.pdf,https://www.wafagestion.com/sites/default/files/documents-en-masse/29-04-2024/weekly_opcvm_26_04_2024.pdf,2025-12-19 18:44:11,2024-04-26
84.0,84.0,22-04-2024.pdf,https://www.wafagestion.com/sites/default/files/documents-en-masse/22-04-2024/weekly_opcvm_22_04_2024.pdf,2025-12-19 18:44:14,2024-04-22
85.0,85.0,15-04-2024.pdf,https://www.wafagestion.com/sites/default/files/documents-en-masse/16-04-2024/weekly_opcvm_15_04_2024.pdf,2025-12-19 18:44:15,2024-04-15
86.0,86.0,05-04-2024.pdf,https://www.wafagestion.com/sites/default/files/documents-en-masse/09-04-2024/weekly_opcvm_05_04_2024.pdf,2025-12-19 18:44:20,2024-04-05
87.0,87.0,29-03-2024.pdf,https://www.wafagestion.com/sites/default/files/documents-en-masse/01-04-2024/weekly_opcvm_29_03_2024.pdf,2025-12-19 18:44:19,2024-03-29
88.0,88.0,22-03-2024.pdf,https://www.wafagestion.com/sites/default/files/documents-en-masse/25-03-2024/weekly_opcvm_22_03_2024.pdf,2025-12-19 18:44:17,2024-03-22
89.0,89.0,15-03-2024.pdf,https://www.wafagestion.com/sites/default/files/documents-en-masse/18-03-2024/weekly_opcvm_15_03_2024.pdf,2025-12-19 18:44:29,2024-03-15
90.0,90.0,08-03-2024.pdf,https://www.wafagestion.com/sites/default/files/documents-en-masse/14-03-2024/weekly_opcvm_08_03_2024.pdf,2025-12-19 18:44:26,2024-03-08
91.0,91.0,01-03-2024.pdf,https://www.wafagestion.com/sites/default/files/documents-en-masse/05-03-2024/weekly_opcvm_01_03_2024.pdf,2025-12-19 18:44:34,2024-03-01
92.0,92.0,23-02-2024.pdf,https://www.wafagestion.com/sites/default/files/documents-en-masse/26-02-2024/weekly_opcvm_23_02_2024.pdf,2025-12-19 18:44:39,2024-02-23
93.0,93.0,16-02-2024.pdf,https://www.wafagestion.com/sites/default/files/documents-en-masse/19-02-2024/weekly_opcvm_16_02_2024.pdf,2025-12-19 18:44:33,2024-02-16
94.0,94.0,09-02-2024.pdf,https://www.wafagestion.com/sites/default/files/documents-en-masse/13-02-2024/weekly_opcvm_09_02_2024.pdf,2025-12-19 18:44:28,2024-02-09
95.0,95.0,02-02-2024.pdf,https://www.wafagestion.com/sites/default/files/documents-en-masse/13-02-2024/weekly_opcvm_02_02_2024.pdf,2025-12-19 18:44:30,2024-02-02
96.0,96.0,26-01-2024.pdf,https://www.wafagestion.com/sites/default/files/documents-en-masse/29-01-2024/weekly_opcvm_26_01_2024.pdf,2025-12-19 18:44:31,2024-01-26
97.0,97.0,19-01-2024.pdf,https://www.wafagestion.com/sites/default/files/documents-en-masse/23-01-2024/weekly_opcvm_19_01_2024.pdf,2025-12-19 18:44:37,2024-01-19
98.0,98.0,12-01-2024.pdf,https://www.wafagestion.com/sites/default/files/documents-en-masse/15-01-2024/weekly_opcvm_12_01_2024.pdf,2025-12-19 18:44:50,2024-01-12
99.0,99.0,05-01-2024.pdf,https://www.wafagestion.com/sites/default/files/documents-en-masse/15-01-2024/weekly_opcvm_05_01_2024.pdf,2025-12-19 18:44:49,2024-01-05
100.0,100.0,29-12-2023.pdf,https://www.wafagestion.com/sites/default/files/documents-en-masse/03-01-2024/weekly_opcvm_29_12_2023.pdf,2025-12-19 18:44:45,2023-12-29
101.0,101.0,22-12-2023.pdf,https://www.wafagestion.com/sites/default/files/documents-en-masse/27-12-2023/weekly_opcvm_22_12_2023.pdf,2025-12-19 18:44:51,2023-12-22
102.0,102.0,15-12-2023.pdf,https://www.wafagestion.com/sites/default/files/documents-en-masse/18-12-2023/weekly_opcvm_15_12_2023.pdf,2025-12-19 18:44:41,2023-12-15
103.0,103.0,08-12-2023.pdf,https://www.wafagestion.com/sites/default/files/documents-en-masse/11-12-2023/weekly_opcvm_08_12_2023.pdf,2025-12-19 18:44:42,2023-12-08
104.0,104.0,04-12-2023.pdf,https://www.wafagestion.com/sites/default/files/documents-en-masse/04-12-2023/weekly_opcvm_04_12_2023.pdf,2025-12-19 18:44:44,2023-12-04
105.0,105.0,24-11-2023.pdf,https://www.wafagestion.com/sites/default/files/documents-en-masse/27-11-2023/weekly_opcvm_24_11_2023.pdf,2025-12-19 18:44:46,2023-11-24
106.0,106.0,17-11-2023.pdf,https://www.wafagestion.com/sites/default/files/documents-en-masse/20-11-2023/weekly_opcvm_17_11_2023.pdf,2025-12-19 18:44:48,2023-11-17
107.0,107.0,10-11-2023.pdf,https://www.wafagestion.com/sites/default/files/documents-en-masse/13-11-2023/weekly_opcvm_10_11_2023.pdf,2025-12-19 18:44:54,2023-11-10
108.0,108.0,03-11-2023.pdf,https://www.wafagestion.com/sites/default/files/documents-en-masse/07-11-2023/weekly_opcvm_03_11_2023.pdf,2025-12-19 18:44:58,2023-11-03
109.0,109.0,27-10-2023.pdf,https://www.wafagestion.com/sites/default/files/documents-en-masse/30-10-2023/weekly_opcvm_27_10_2023.pdf,2025-12-19 18:45:02,2023-10-27
110.0,110.0,20-10-2023.pdf,https://www.wafagestion.com/sites/default/files/documents-en-masse/23-10-2023/weekly_opcvm_20_10_2023.pdf,2025-12-19 18:44:55,2023-10-20
111.0,111.0,13-10-2023.pdf,https://www.wafagestion.com/sites/default/files/documents-en-masse/16-10-2023/weekly_opcvm_13_10_2023.pdf,2025-12-19 18:45:01,2023-10-13
112.0,112.0,06-10-2023.pdf,https://www.wafagestion.com/sites/default/files/documents-en-masse/12-10-2023/weekly_opcvm_06_10_2023.pdf,2025-12-19 18:45:03,2023-10-06
113.0,113.0,02-10-2023.pdf,https://www.wafagestion.com/sites/default/files/documents-en-masse/06-10-2023/weekly_opcvm_02_10_2023.pdf,2025-12-19 18:44:59,2023-10-02
114.0,114.0,22-09-2023.pdf,https://www.wafagestion.com/sites/default/files/documents-en-masse/25-09-2023/weekly_opcvm_22_09_2023.pdf,2025-12-19 18:45:04,2023-09-22
115.0,115.0,15-09-2023.pdf,https://www.wafagestion.com/sites/default/files/documents-en-masse/18-09-2023/weekly_opcvm_15_09_2023.pdf,2025-12-19 18:44:57,2023-09-15
116.0,116.0,08-09-2023.pdf,https://www.wafagestion.com/sites/default/files/documents-en-masse/11-09-2023/weekly_opcvm_08_09_2023.pdf,2025-12-19 18:45:18,2023-09-08
117.0,117.0,25-08-2023.pdf,https://www.wafagestion.com/sites/default/files/documents-en-masse/31-08-2023/weekly_opcvm_25_08_2023.pdf,2025-12-19 18:45:23,2023-08-25
118.0,118.0,18-08-2023.pdf,https://www.wafagestion.com/sites/default/files/documents-en-masse/25-08-2023/weekly_opcvm_18_08_2023.pdf,2025-12-19 18:45:08,2023-08-18
119.0,119.0,11-08-2023.pdf,https://www.wafagestion.com/sites/default/files/documents-en-masse/22-08-2023/weekly_opcvm_11_08_2023.pdf,2025-12-19 18:45:22,2023-08-11
120.0,120.0,04-08-2023.pdf,https://www.wafagestion.com/sites/default/files/documents-en-masse/11-08-2023/weekly_opcvm_04_08_2023.pdf,2025-12-19 18:45:13,2023-08-04
121.0,121.0,28-07-2023.pdf,https://www.wafagestion.com/sites/default/files/documents-en-masse/03-08-2023/weekly_opcvm_28_07_2023.pdf,2025-12-19 18:45:19,2023-07-28
122.0,122.0,21-07-2023.pdf,https://www.wafagestion.com/sites/default/files/documents-en-masse/26-07-2023/weekly_opcvm_21_07_2023.pdf,2025-12-19 18:45:07,2023-07-21
123.0,123.0,14-07-2023.pdf,https://www.wafagestion.com/sites/default/files/documents-en-masse/21-07-2023/weekly_opcvm_14_07_2023.pdf,2025-12-19 18:45:14,2023-07-14
124.0,124.0,07-07-2023.pdf,https://www.wafagestion.com/sites/default/files/documents-en-masse/13-07-2023/weekly_opcvm_07_07_2023.pdf,2025-12-19 18:45:20,2023-07-07
125.0,125.0,03-07-2023.pdf,https://www.wafagestion.com/sites/default/files/documents-en-masse/05-07-2023/weekly_opcvm_03_07_2023.pdf,2025-12-19 18:45:30,2023-07-03
126.0,126.0,23-06-2023.pdf,https://www.wafagestion.com/sites/default/files/documents-en-masse/05-07-2023/weekly_opcvm_23_06_2023.pdf,2025-12-19 18:45:42,2023-06-23
127.0,127.0,16-06-2023.pdf,https://www.wafagestion.com/sites/default/files/documents-en-masse/19-06-2023/weekly_opcvm_16_06_2023.pdf,2025-12-19 18:45:35,2023-06-16
128.0,128.0,09-06-2023.pdf,https://www.wafagestion.com/sites/default/files/documents-en-masse/12-06-2023/weekly_opcvm_09_06_2023.pdf,2025-12-19 18:45:28,2023-06-09
129.0,129.0,02-06-2023.pdf,https://www.wafagestion.com/sites/default/files/documents-en-masse/06-06-2023/weekly_opcvm_02_06_2023.pdf,2025-12-19 18:45:43,2023-06-02
130.0,130.0,26-05-2023.pdf,https://www.wafagestion.com/sites/default/files/documents-en-masse/29-05-2023/weekly_opcvm_26_05_2023.pdf,2025-12-19 18:45:29,2023-05-26
131.0,131.0,19-05-2023.pdf,https://www.wafagestion.com/sites/default/files/documents-en-masse/22-05-2023/weekly_opcvm_19_05_2023.pdf,2025-12-19 18:45:40,2023-05-19
132.0,132.0,12-05-2023.pdf,https://www.wafagestion.com/sites/default/files/documents-en-masse/15-05-2023/weekly_opcvm_12_05_2023.pdf,2025-12-19 18:45:37,2023-05-12
133.0,133.0,05-05-2023.pdf,https://www.wafagestion.com/sites/default/files/documents-en-masse/08-05-2023/weekly_opcvm_05_05_2023.pdf,2025-12-19 18:45:34,2023-05-05
134.0,134.0,28-04-2023.pdf,https://www.wafagestion.com/sites/default/files/documents-en-masse/02-05-2023/weekly_opcvm_28_04_2023.pdf,2025-12-19 18:45:45,2023-04-28
135.0,135.0,21-04-2023.pdf,https://www.wafagestion.com/sites/default/files/documents-en-masse/25-04-2023/weekly_opcvm_21_04_2023.pdf,2025-12-19 18:45:52,2023-04-21
136.0,136.0,14-04-2023.pdf,https://www.wafagestion.com/sites/default/files/documents-en-masse/17-04-2023/weekly_opcvm_14_04_2023.pdf,2025-12-19 18:45:48,2023-04-14
137.0,137.0,07-04-2023.pdf,https://www.wafagestion.com/sites/default/files/documents-en-masse/10-04-2023/weekly_opcvm_07_04_2023.pdf,2025-12-19 18:45:49,2023-04-07
138.0,138.0,31-03-2023.pdf,https://www.wafagestion.com/sites/default/files/documents-en-masse/03-04-2023/weekly_opcvm_31_03_2023.pdf,2025-12-19 18:45:47,2023-03-31
139.0,139.0,24-03-2023.pdf,https://www.wafagestion.com/sites/default/files/documents-en-masse/27-03-2023/weekly_opcvm_24_03_2023.pdf,2025-12-19 18:45:59,2023-03-24
140.0,140.0,17-03-2023.pdf,https://www.wafagestion.com/sites/default/files/documents-en-masse/20-03-2023/weekly_opcvm_17_03_2023.pdf,2025-12-19 18:45:58,2023-03-17
141.0,141.0,10-03-2023.pdf,https://www.wafagestion.com/sites/default/files/documents-en-masse/13-03-2023/weekly_opcvm_10_03_2023.pdf,2025-12-19 18:45:53,2023-03-10
142.0,142.0,03-03-2023.pdf,https://www.wafagestion.com/sites/default/files/documents-en-masse/06-03-2023/weekly_opcvm_03_03_2023.pdf,2025-12-19 18:45:50,2023-03-03
143.0,143.0,24-02-2023.pdf,https://www.wafagestion.com/sites/default/files/documents-en-masse/27-02-2023/weekly_opcvm_24_02_2023.pdf,2025-12-19 18:45:57,2023-02-24
144.0,144.0,17-02-2023.pdf,https://www.wafagestion.com/sites/default/files/documents-en-masse/20-02-2023/weekly_opcvm_17_02_2023.pdf,2025-12-19 18:46:12,2023-02-17
145.0,145.0,10-02-2023.pdf,https://www.wafagestion.com/sites/default/files/documents-en-masse/13-02-2023/weekly_opcvm_10_02_2023.pdf,2025-12-19 18:46:08,2023-02-10
146.0,146.0,03-02-2023.pdf,https://www.wafagestion.com/sites/default/files/documents-en-masse/06-02-2023/weekly_opcvm_03_02_2023.pdf,2025-12-19 18:46:19,2023-02-03
147.0,147.0,27-01-2023.pdf,https://www.wafagestion.com/sites/default/files/documents-en-masse/30-01-2023/weekly_opcvm_27_01_2023.pdf,2025-12-19 18:46:18,2023-01-27
148.0,148.0,20-01-2023.pdf,https://www.wafagestion.com/sites/default/files/documents-en-masse/23-01-2023/weekly_opcvm_20_01_2023.pdf,2025-12-19 18:46:17,2023-01-20
149.0,149.0,06-01-2023.pdf,https://www.wafagestion.com/sites/default/files/documents-en-masse/10-01-2023/weekly_opcvm_06_01_2023.pdf,2025-12-19 18:46:03,2023-01-06
150.0,150.0,31-12-2022.pdf,https://www.wafagestion.com/sites/default/files/documents-en-masse/02-01-2023/weekly_opcvm_31_12_2022.pdf,2025-12-19 18:46:02,2022-12-31
151.0,151.0,23-12-2022.pdf,https://www.wafagestion.com/sites/default/files/documents-en-masse/26-12-2022/weekly_opcvm_23_12_2022.pdf,2025-12-19 18:46:07,2022-12-23
152.0,152.0,16-12-2022.pdf,https://www.wafagestion.com/sites/default/files/documents-en-masse/20-12-2022/weekly_opcvm_16_12_2022.pdf,2025-12-19 18:46:15,2022-12-16
153.0,153.0,09-12-2022.pdf,https://www.wafagestion.com/sites/default/files/documents-en-masse/12-12-2022/weekly_opcvm_09_12_2022.pdf,2025-12-19 18:46:23,2022-12-09
154.0,154.0,02-12-2022.pdf,https://www.wafagestion.com/sites/default/files/documents-en-masse/05-12-2022/weekly_opcvm_02_12_2022.pdf,2025-12-19 18:46:37,2022-12-02
155.0,155.0,25-11-2022.pdf,https://www.wafagestion.com/sites/default/files/documents-en-masse/28-11-2022/weekly_opcvm_25_11_2022.pdf,2025-12-19 18:46:39,2022-11-25
156.0,156.0,21-11-2022.pdf,https://www.wafagestion.com/sites/default/files/documents-en-masse/22-11-2022/weekly_opcvm_21_11_2022.pdf,2025-12-19 18:46:24,2022-11-21
157.0,157.0,11-11-2022.pdf,https://www.wafagestion.com/sites/default/files/documents-en-masse/14-11-2022/weekly_opcvm_11_11_2022.pdf,2025-12-19 18:46:26,2022-11-11
158.0,158.0,04-11-2022.pdf,https://www.wafagestion.com/sites/default/files/documents-en-masse/09-11-2022/weekly_opcvm_04_11_2022.pdf,2025-12-19 18:46:35,2022-11-04
159.0,159.0,28-10-2022.pdf,https://www.wafagestion.com/sites/default/files/documents-en-masse/31-10-2022/weekly_opcvm_28_10_2022.pdf,2025-12-19 18:46:33,2022-10-28
160.0,160.0,21-10-2022.pdf,https://www.wafagestion.com/sites/default/files/documents-en-masse/24-10-2022/weekly_opcvm_21_10_2022.pdf,2025-12-19 18:46:36,2022-10-21
161.0,161.0,14-10-2022.pdf,https://www.wafagestion.com/sites/default/files/documents-en-masse/17-10-2022/weekly_opcvm_14_10_2022.pdf,2025-12-19 18:46:22,2022-10-14
162.0,162.0,07-10-2022.pdf,https://www.wafagestion.com/sites/default/files/documents-en-masse/11-10-2022/weekly_opcvm_07_10_2022.pdf,2025-12-19 18:46:29,2022-10-07
163.0,163.0,30-09-2022.pdf,https://www.wafagestion.com/sites/default/files/documents-en-masse/04-10-2022/weekly_opcvm_30_09_2022.pdf,2025-12-19 18:46:53,2022-09-30
164.0,164.0,23-09-2022.pdf,https://www.wafagestion.com/sites/default/files/documents-en-masse/26-09-2022/weekly_opcvm_23_09_2022.pdf,2025-12-19 18:46:57,2022-09-23
165.0,165.0,16-09-2022.pdf,https://www.wafagestion.com/sites/default/files/documents-en-masse/19-09-2022/weekly_opcvm_16_09_2022.pdf,2025-12-19 18:46:52,2022-09-16
166.0,166.0,09-09-2022.pdf,https://www.wafagestion.com/sites/default/files/documents-en-masse/12-09-2022/weekly_opcvm_09_09_2022.pdf,2025-12-19 18:46:51,2022-09-09
167.0,167.0,02-09-2022.pdf,https://www.wafagestion.com/sites/default/files/documents-en-masse/05-09-2022/weekly_opcvm_02_09_2022.pdf,2025-12-19 18:46:41,2022-09-02
168.0,168.0,26-08-2022.pdf,https://www.wafagestion.com/sites/default/files/documents-en-masse/29-08-2022/weekly_opcvm_26_08_2022.pdf,2025-12-19 18:46:55,2022-08-26
169.0,169.0,19-08-2022.pdf,https://www.wafagestion.com/sites/default/files/2022-08/Weekly_OPCVM_19_08_2022.pdf,2025-12-19 18:46:43,2022-08-19
170.0,170.0,12-08-2022.pdf,https://www.wafagestion.com/sites/default/files/documents-en-masse/29-08-2022/weekly_opcvm_12_08_2022.pdf,2025-12-19 18:46:47,2022-08-12
171.0,171.0,05-08-2022.pdf,https://www.wafagestion.com/sites/default/files/documents-en-masse/06-08-2022/weekly_opcvm_05_08_2022.pdf,2025-12-19 18:46:56,2022-08-05
172.0,172.0,29-07-2022.pdf,https://www.wafagestion.com/sites/default/files/documents-en-masse/02-08-2022/weekly_opcvm_29_07_2022.pdf,2025-12-19 18:47:01,2022-07-29
173.0,173.0,22-07-2022.pdf,https://www.wafagestion.com/sites/default/files/documents-en-masse/25-07-2022/weekly_opcvm_22_07_2022.pdf,2025-12-19 18:47:13,2022-07-22
174.0,174.0,15-07-2022.pdf,https://www.wafagestion.com/sites/default/files/documents-en-masse/18-07-2022/weekly_opcvm_15_07_2022.pdf,2025-12-19 18:47:05,2022-07-15
175.0,175.0,08-07-2022.pdf,https://www.wafagestion.com/sites/default/files/documents-en-masse/14-07-2022/weekly_opcvm_08_07_2022.pdf,2025-12-19 18:47:06,2022-07-08
176.0,176.0,01-07-2022.pdf,https://www.wafagestion.com/sites/default/files/documents-en-masse/06-07-2022/weekly_opcvm_01_07_2022.pdf,2025-12-19 18:47:00,2022-07-01
177.0,177.0,24-06-2022.pdf,https://www.wafagestion.com/sites/default/files/documents-en-masse/28-06-2022/weekly_opcvm_24_06_2022.pdf,2025-12-19 18:47:10,2022-06-24
178.0,178.0,17-06-2022.pdf,https://www.wafagestion.com/sites/default/files/documents-en-masse/20-06-2022/weekly_opcvm_17_06_2022.pdf,2025-12-19 18:47:11,2022-06-17
179.0,179.0,10-06-2022.pdf,https://www.wafagestion.com/sites/default/files/documents-en-masse/13-06-2022/weekly_opcvm_10_06_2022.pdf,2025-12-19 18:47:08,2022-06-10
180.0,180.0,03-06-2022.pdf,https://www.wafagestion.com/sites/default/files/documents-en-masse/07-06-2022/weekly_opcvm_03_06_2022.pdf,2025-12-19 18:47:14,2022-06-03
181.0,181.0,27-05-2022.pdf,https://www.wafagestion.com/sites/default/files/documents-en-masse/31-05-2022/weekly_opcvm_27_05_2022.pdf,2025-12-19 18:47:07,2022-05-27
182.0,182.0,20-05-2022.pdf,https://www.wafagestion.com/sites/default/files/documents-en-masse/23-05-2022/weekly_opcvm_20_05_2022.pdf,2025-12-19 18:47:29,2022-05-20
183.0,183.0,13-05-2022.pdf,https://www.wafagestion.com/sites/default/files/documents-en-masse/17-05-2022/weekly_opcvm_13_05_2022.pdf,2025-12-19 18:47:27,2022-05-13
184.0,184.0,06-05-2022.pdf,https://www.wafagestion.com/sites/default/files/documents-en-masse/10-05-2022/weekly_opcvm_06_05_2022.pdf,2025-12-19 18:47:30,2022-05-06
185.0,185.0,22-04-2022.pdf,https://www.wafagestion.com/sites/default/files/documents-en-masse/25-04-2022/weekly_opcvm_22_04_2022.pdf,2025-12-19 18:47:20,2022-04-22
186.0,186.0,15-04-2022.pdf,https://www.wafagestion.com/sites/default/files/documents-en-masse/18-04-2022/weekly_opcvm_15_04_2022.pdf,2025-12-19 18:47:31,2022-04-15
187.0,187.0,08-04-2022.pdf,https://www.wafagestion.com/sites/default/files/documents-en-masse/11-04-2022/weekly_opcvm_08_04_2022.pdf,2025-12-19 18:47:33,2022-04-08
188.0,188.0,01-04-2022.pdf,https://www.wafagestion.com/sites/default/files/documents-en-masse/04-04-2022/weekly_opcvm_01_04_2022.pdf,2025-12-19 18:47:22,2022-04-01
189.0,189.0,25-03-2022.pdf,https://www.wafagestion.com/sites/default/files/documents-en-masse/28-03-2022/weekly_opcvm_25_03_2022.pdf,2025-12-19 18:47:23,2022-03-25
190.0,190.0,18-03-2022.pdf,https://www.wafagestion.com/sites/default/files/documents-en-masse/21-03-2022/weekly_opcvm_18_03_2022.pdf,2025-12-19 18:47:17,2022-03-18
191.0,191.0,11-03-2022.pdf,https://www.wafagestion.com/sites/default/files/documents-en-masse/14-03-2022/weekly_opcvm_11_03_2022.pdf,2025-12-19 18:47:25,2022-03-11
192.0,192.0,04-03-2022.pdf,https://www.wafagestion.com/sites/default/files/documents-en-masse/07-03-2022/weekly_opcvm_04_03_2022.pdf,2025-12-19 18:47:39,2022-03-04
193.0,193.0,25-02-2022.pdf,https://www.wafagestion.com/sites/default/files/documents-en-masse/28-02-2022/weekly_opcvm_25_02_2022.pdf,2025-12-19 18:47:35,2022-02-25
194.0,194.0,18-02-2022.pdf,https://www.wafagestion.com/sites/default/files/documents-en-masse/21-02-2022/weekly_opcvm_18_02_2022.pdf,2025-12-19 18:47:50,2022-02-18
195.0,195.0,04-02-2022.pdf,https://www.wafagestion.com/sites/default/files/documents-en-masse/07-02-2022/weekly_opcvm_04_02_2022.pdf,2025-12-19 18:47:41,2022-02-04
196.0,196.0,28-01-2022.pdf,https://www.wafagestion.com/sites/default/files/documents-en-masse/31-01-2022/weekly_opcvm_28_01_2022.pdf,2025-12-19 18:47:45,2022-01-28
197.0,197.0,21-01-2022.pdf,https://www.wafagestion.com/sites/default/files/documents-en-masse/24-01-2022/weekly_opcvm_21_01_2022.pdf,2025-12-19 18:47:52,2022-01-21
198.0,198.0,14-01-2022.pdf,https://www.wafagestion.com/sites/default/files/documents-en-masse/17-01-2022/weekly_opcvm_14_01_2022.pdf,2025-12-19 18:47:42,2022-01-14
199.0,199.0,07-01-2022.pdf,https://www.wafagestion.com/sites/default/files/documents-en-masse/10-01-2022/weekly_opcvm_07_01_2022.pdf,2025-12-19 18:47:38,2022-01-07
200.0,200.0,31-12-2021.pdf,https://www.wafagestion.com/sites/default/files/documents-en-masse/03-01-2022/weekly_opcvm_31_12_2021.pdf,2025-12-19 18:47:47,2021-12-31
201.0,201.0,24-12-2021.pdf,https://www.wafagestion.com/sites/default/files/documents-en-masse/27-12-2021/weekly_opcvm_24_12_2021.pdf,2025-12-19 18:47:37,2021-12-24
202.0,202.0,17-12-2021.pdf,https://www.wafagestion.com/sites/default/files/documents-en-masse/20-12-2021/weekly_opcvm_17_12_2021.pdf,2025-12-19 18:47:55,2021-12-17
203.0,203.0,10-12-2021.pdf,https://www.wafagestion.com/sites/default/files/documents-en-masse/14-12-2021/weekly_opcvm_10_12_2021.pdf,2025-12-19 18:48:09,2021-12-10
204.0,204.0,03-12-2021.pdf,https://www.wafagestion.com/sites/default/files/documents-en-masse/06-12-2021/weekly_opcvm_03_12_2021.pdf,2025-12-19 18:48:08,2021-12-03
205.0,205.0,26-11-2021.pdf,https://www.wafagestion.com/sites/default/files/documents-en-masse/30-11-2021/weekly_opcvm_26_11_2021.pdf,2025-12-19 18:47:57,2021-11-26
206.0,206.0,19-11-2021.pdf,https://www.wafagestion.com/sites/default/files/2021-11/weekly_opcvm_19_11_2021.pdf,2025-12-19 18:48:03,2021-11-19
207.0,207.0,12-11-2021.pdf,https://www.wafagestion.com/sites/default/files/2021-11/WEEKLY_OPCVM_12_11_2021.pdf,2025-12-19 18:47:59,2021-11-12
208.0,208.0,05-11-2021.pdf,https://www.wafagestion.com/sites/default/files/documents-en-masse/08-11-2021/weekly_opcvm_05_11_2021.pdf,2025-12-19 18:48:02,2021-11-05
209.0,209.0,29-10-2021.pdf,https://www.wafagestion.com/sites/default/files/documents-en-masse/01-11-2021/weekly_opcvm_29_10_2021.pdf,2025-12-19 18:48:00,2021-10-29
210.0,210.0,22-10-2021.pdf,https://www.wafagestion.com/sites/default/files/documents-en-masse/25-10-2021/weekly_opcvm_22_10_2021.pdf,2025-12-19 18:47:56,2021-10-22
211.0,211.0,15-10-2021.pdf,https://www.wafagestion.com/sites/default/files/documents-en-masse/18-10-2021/weekly_opcvm_15_10_2021.pdf,2025-12-19 18:48:06,2021-10-15
212.0,212.0,08-10-2021.pdf,https://www.wafagestion.com/sites/default/files/documents-en-masse/11-10-2021/weekly_opcvm_08_10_2021.pdf,2025-12-19 18:48:18,2021-10-08
213.0,213.0,01-10-2021.pdf,https://www.wafagestion.com/sites/default/files/documents-en-masse/04-10-2021/weekly_opcvm_01_10_2021.pdf,2025-12-19 18:48:12,2021-10-01
214.0,214.0,24-09-2021.pdf,https://www.wafagestion.com/sites/default/files/documents-en-masse/27-09-2021/weekly_opcvm_24_09_2021.pdf,2025-12-19 18:48:16,2021-09-24
215.0,215.0,17-09-2021.pdf,https://www.wafagestion.com/sites/default/files/documents-en-masse/20-09-2021/weekly_opcvm_17_09_2021.pdf,2025-12-19 18:48:19,2021-09-17
216.0,216.0,10-09-2021.pdf,https://www.wafagestion.com/sites/default/files/documents-en-masse/13-09-2021/weekly_opcvm_10_09_2021.pdf,2025-12-19 18:48:14,2021-09-10
217.0,217.0,03-09-2021.pdf,https://www.wafagestion.com/sites/default/files/documents-en-masse/06-09-2021/weekly_opcvm_03_09_2021.pdf,2025-12-19 18:48:13,2021-09-03
218.0,218.0,27-08-2021.pdf,https://www.wafagestion.com/sites/default/files/documents-en-masse/30-08-2021/weekly_opcvm_27_08_2021.pdf,2025-12-19 18:48:24,2021-08-27
219.0,219.0,23-08-2021.pdf,https://www.wafagestion.com/sites/default/files/documents-en-masse/24-08-2021/weekly_opcvm_23_08_2021.pdf,2025-12-19 18:48:23,2021-08-23
220.0,220.0,13-08-2021.pdf,https://www.wafagestion.com/sites/default/files/documents-en-masse/16-08-2021/weekly_opcvm_13_08_2021.pdf,2025-12-19 18:48:21,2021-08-13
221.0,221.0,06-08-2021.pdf,https://www.wafagestion.com/sites/default/files/documents-en-masse/13-08-2021/weekly_opcvm_06_08_2021.pdf,2025-12-19 18:48:17,2021-08-06
222.0,222.0,02-08-2021.pdf,https://www.wafagestion.com/sites/default/files/documents-en-masse/13-08-2021/weekly_opcvm_02_08_2021.pdf,2025-12-19 18:48:28,2021-08-02
223.0,223.0,23-07-2021.pdf,https://www.wafagestion.com/sites/default/files/documents-en-masse/26-07-2021/weekly_opcvm_23_07_2021.pdf,2025-12-19 18:48:31,2021-07-23
224.0,224.0,16-07-2021.pdf,https://www.wafagestion.com/sites/default/files/documents-en-masse/19-07-2021/weekly_opcvm_16_07_2021.pdf,2025-12-19 18:48:30,2021-07-16
225.0,225.0,09-07-2021.pdf,https://www.wafagestion.com/sites/default/files/documents-en-masse/12-07-2021/weekly_opcvm_09_07_2021.pdf,2025-12-19 18:48:34,2021-07-09
226.0,226.0,02-07-2021.pdf,https://www.wafagestion.com/sites/default/files/documents-en-masse/06-07-2021/weekly_opcvm_02_07_2021.pdf,2025-12-19 18:48:33,2021-07-02
227.0,227.0,24-06-2021.pdf,https://www.wafagestion.com/sites/default/files/documents-en-masse/28-06-2021/weekly_opcvm_24_06_2021.pdf,2025-12-19 18:48:27,2021-06-24
228.0,228.0,18-06-2021.pdf,https://www.wafagestion.com/sites/default/files/documents-en-masse/21-06-2021/weekly_opcvm_18_06_2021.pdf,2025-12-19 18:48:39,2021-06-18
229.0,229.0,11-06-2021.pdf,https://www.wafagestion.com/sites/default/files/documents-en-masse/14-06-2021/weekly_opcvm_11_06_2021.pdf,2025-12-19 18:48:40,2021-06-11
230.0,230.0,04-06-2021.pdf,https://www.wafagestion.com/sites/default/files/documents-en-masse/07-06-2021/weekly_opcvm_04_06_2021.pdf,2025-12-19 18:48:41,2021-06-04
231.0,231.0,28-05-2021.pdf,https://www.wafagestion.com/sites/default/files/documents-en-masse/31-05-2021/weekly_opcvm_28_05_2021.pdf,2025-12-19 18:48:35,2021-05-28
232.0,232.0,21-05-2021.pdf,https://www.wafagestion.com/sites/default/files/documents-en-masse/24-05-2021/weekly_opcvm_21_05_2021.pdf,2025-12-19 18:48:57,2021-05-21
233.0,233.0,17-05-2021.pdf,https://www.wafagestion.com/sites/default/files/documents-en-masse/19-05-2021/weekly_opcvm_17_05_2021.pdf,2025-12-19 18:49:00,2021-05-17
234.0,234.0,07-05-2021.pdf,https://www.wafagestion.com/sites/default/files/documents-en-masse/10-05-2021/weekly_opcvm_07_05_2021.pdf,2025-12-19 18:48:45,2021-05-07
235.0,235.0,30-04-2021.pdf,https://www.wafagestion.com/sites/default/files/documents-en-masse/04-05-2021/weekly_opcvm_30_04_2021.pdf,2025-12-19 18:48:54,2021-04-30
236.0,236.0,23-04-2021.pdf,https://www.wafagestion.com/sites/default/files/documents-en-masse/26-04-2021/weekly_opcvm_23_04_2021.pdf,2025-12-19 18:48:47,2021-04-23
237.0,237.0,16-04-2021.pdf,https://www.wafagestion.com/sites/default/files/documents-en-masse/19-04-2021/weekly_opcvm_16_04_2021.pdf,2025-12-19 18:48:56,2021-04-16
238.0,238.0,09-04-2021.pdf,https://www.wafagestion.com/sites/default/files/documents-en-masse/13-04-2021/weekly_opcvm_09_04_2021.pdf,2025-12-19 18:48:44,2021-04-09
239.0,239.0,02-04-2021.pdf,https://www.wafagestion.com/sites/default/files/documents-en-masse/08-04-2021/weekly_opcvm_02_04_2021.pdf,2025-12-19 18:48:58,2021-04-02
240.0,240.0,26-03-2021.pdf,https://www.wafagestion.com/sites/default/files/documents-en-masse/30-03-2021/weekly_opcvm_26_03_2021.pdf,2025-12-19 18:48:50,2021-03-26
241.0,241.0,19-03-2021.pdf,https://www.wafagestion.com/sites/default/files/documents-en-masse/24-03-2021/weekly_opcvm_19_03_2021.pdf,2025-12-19 18:49:04,2021-03-19
242.0,242.0,12-03-2021.pdf,https://www.wafagestion.com/sites/default/files/documents-en-masse/16-03-2021/weekly_opcvm_12_03_2021.pdf,2025-12-19 18:49:20,2021-03-12
243.0,243.0,05-03-2021.pdf,https://www.wafagestion.com/sites/default/files/documents-en-masse/10-03-2021/weekly_opcvm_05_03_2021.pdf,2025-12-19 18:49:19,2021-03-05
244.0,244.0,26-02-2021.pdf,https://www.wafagestion.com/sites/default/files/documents-en-masse/03-03-2021/weekly_opcvm_26_02_2021.pdf,2025-12-19 18:49:16,2021-02-26
245.0,245.0,19-02-2021.pdf,https://www.wafagestion.com/sites/default/files/documents-en-masse/23-02-2021/weekly_opcvm_19_02_2021.pdf,2025-12-19 18:49:14,2021-02-19
246.0,246.0,12-02-2021.pdf,https://www.wafagestion.com/sites/default/files/2021-02/WEEKLY%20OPCVM%2012_02_2021.pdf,2025-12-19 18:49:09,2021-02-12
247.0,247.0,29-01-2021.pdf,https://www.wafagestion.com/sites/default/files/documents-en-masse/02-02-2021/weekly_opcvm_29_01_2021.pdf,2025-12-19 18:49:12,2021-01-29
248.0,248.0,22-01-2021.pdf,https://www.wafagestion.com/sites/default/files/documents-en-masse/26-01-2021/weekly_opcvm_22_01_2021.pdf,2025-12-19 18:49:07,2021-01-22
249.0,249.0,15-01-2021.pdf,https://www.wafagestion.com/sites/default/files/documents-en-masse/19-01-2021/weekly_opcvm_15_01_2021.pdf,2025-12-19 18:49:15,2021-01-15
250.0,250.0,08-01-2021.pdf,https://www.wafagestion.com/sites/default/files/2021-01/WEEKLY%20OPCVM%2008012021.pdf,2025-12-19 18:49:18,2021-01-08
,,19-12-2025.pdf,https://www.wafagestion.com/sites/default/files/documents-en-masse/22-12-2025/weekly_opcvm_19_12_2025.pdf,2025-12-23 00:00:05,2025-12-19
